[
  {
    "enacted_by": "Parliament",
    "instrument_id": "instrument-act-companies-act-1985",
    "instrument_type": "act",
    "legislation_url": "https://www.legislation.gov.uk/ukpga/1985/6",
    "made_under": null,
    "notes": "Breadcrumb (s.124A trigger): Part XIV company-investigation reports found expedient in the public interest can ground a winding-up petition. Future corporate-enforcement domain; registered, not extracted.",
    "number": "6",
    "record_status": "extracted",
    "source_id": "source-act-companies-act-1985",
    "status": "in_force",
    "title": "Companies Act 1985",
    "year": 1985
  },
  {
    "enacted_by": "Parliament",
    "instrument_id": "instrument-act-competition-act-1998",
    "instrument_type": "act",
    "legislation_url": "https://www.legislation.gov.uk/ukpga/1998/41",
    "made_under": null,
    "notes": "Cross-cutting spine: the Chapter I/II prohibitions and the concurrency regime by which sector regulators (Ofwat, Ofgem, etc.) enforce competition law in their sector alongside the CMA. Reached from WIA 1991 s.22A.",
    "number": "41",
    "record_status": "extracted",
    "source_id": "source-act-competition-act-1998",
    "status": "in_force",
    "title": "Competition Act 1998",
    "year": 1998
  },
  {
    "enacted_by": "Parliament",
    "instrument_id": "instrument-act-criminal-justice-act-1987",
    "instrument_type": "act",
    "legislation_url": "https://www.legislation.gov.uk/ukpga/1987/38",
    "made_under": null,
    "notes": "Breadcrumb (s.124A trigger): SFO fraud-investigation information (s.2) can ground a public-interest winding-up. Registered, not extracted.",
    "number": "38",
    "record_status": "extracted",
    "source_id": "source-act-criminal-justice-act-1987",
    "status": "in_force",
    "title": "Criminal Justice Act 1987",
    "year": 1987
  },
  {
    "enacted_by": "Parliament",
    "instrument_id": "instrument-act-enterprise-act-2002",
    "instrument_type": "act",
    "legislation_url": "https://www.legislation.gov.uk/ukpga/2002/40",
    "made_under": null,
    "notes": "Cross-cutting spine: the CMA's general investigation and order-making machinery, applied to the water references by WIA 1991 ss.17M/17R and reached the same way by every regulated sector. Scoped to the reached provisions, not the whole Act.",
    "number": "40",
    "record_status": "extracted",
    "source_id": "source-act-enterprise-act-2002",
    "status": "in_force",
    "title": "Enterprise Act 2002",
    "year": 2002
  },
  {
    "enacted_by": "Parliament",
    "instrument_id": "instrument-act-financial-services-and-markets-act-2000",
    "instrument_type": "act",
    "legislation_url": "https://www.legislation.gov.uk/ukpga/2000/8",
    "made_under": null,
    "notes": "Breadcrumb (s.124A trigger): FCA/inspector reports under FSMA can ground a public-interest winding-up. Registered, not extracted.",
    "number": "8",
    "record_status": "extracted",
    "source_id": "source-act-financial-services-and-markets-act-2000",
    "status": "in_force",
    "title": "Financial Services and Markets Act 2000",
    "year": 2000
  },
  {
    "enacted_by": "Parliament",
    "instrument_id": "instrument-act-insolvency-act-1986",
    "instrument_type": "act",
    "legislation_url": "https://www.legislation.gov.uk/ukpga/1986/45",
    "made_under": null,
    "notes": "Breadcrumb: the water SAR (WIA 1991 s.24, Sch 3) applies and modifies Insolvency Act 1986 machinery. s.124A = the SoS winding-up petition referenced by WIA s.24(2)(d).",
    "number": "45",
    "record_status": "extracted",
    "source_id": "source-act-insolvency-act-1986",
    "status": "in_force",
    "title": "Insolvency Act 1986",
    "year": 1986
  },
  {
    "enacted_by": "Parliament",
    "instrument_id": "instrument-act-planning-act-2008",
    "instrument_type": "act",
    "legislation_url": "https://www.legislation.gov.uk/ukpga/2008/29",
    "made_under": null,
    "notes": "Planning/infrastructure Tranche A — the DCO regime by which a large reservoir (an NSIP) is consented. Scoped to the decision-spine + the compulsory-acquisition and other-consents provisions the reservoir chain reaches.",
    "number": "29",
    "record_status": "extracted",
    "source_id": "source-act-planning-act-2008",
    "status": "in_force",
    "title": "Planning Act 2008",
    "year": 2008
  },
  {
    "enacted_by": "Parliament",
    "instrument_id": "instrument-act-water-act-2014",
    "instrument_type": "act",
    "legislation_url": "https://www.legislation.gov.uk/ukpga/2014/21",
    "made_under": null,
    "notes": "Amending instrument: operates chiefly by amending the Water Industry Act 1991. Operative powers/duties are extracted from the consolidated WIA 1991 text, citing this Act as amending provenance. s.22 inserts the resilience objective (WIA 1991 s.2(2A)(e), s.2(2DA)).",
    "number": "21",
    "record_status": "extracted",
    "source_id": "source-act-water-act-2014",
    "status": "in_force",
    "title": "Water Act 2014",
    "year": 2014
  },
  {
    "enacted_by": "Parliament",
    "instrument_id": "instrument-act-water-industry-act-1991",
    "instrument_type": "act",
    "legislation_url": "https://www.legislation.gov.uk/ukpga/1991/56",
    "made_under": null,
    "notes": null,
    "number": "56",
    "record_status": "extracted",
    "source_id": "source-act-water-industry-act-1991",
    "status": "in_force",
    "title": "Water Industry Act 1991",
    "year": 1991
  },
  {
    "enacted_by": "Parliament",
    "instrument_id": "instrument-act-water-resources-act-1991",
    "instrument_type": "act",
    "legislation_url": "https://www.legislation.gov.uk/ukpga/1991/57",
    "made_under": null,
    "notes": null,
    "number": "57",
    "record_status": "extracted",
    "source_id": "source-act-water-resources-act-1991",
    "status": "in_force",
    "title": "Water Resources Act 1991",
    "year": 1991
  },
  {
    "enacted_by": "Parliament",
    "instrument_id": "instrument-act-water-special-measures-act-2025",
    "instrument_type": "act",
    "legislation_url": "https://www.legislation.gov.uk/ukpga/2025/5",
    "made_under": null,
    "notes": "Latest amendment to the water SAR: s.14 gives the SoS a shortfall-recovery power (modify licences to recover SAR costs not met by a sale/rescue). Registered via the retrodiction; full extraction is a follow-on.",
    "number": "5",
    "record_status": "extracted",
    "source_id": "source-act-water-special-measures-act-2025",
    "status": "in_force",
    "title": "Water (Special Measures) Act 2025",
    "year": 2025
  },
  {
    "enacted_by": "Parliament",
    "instrument_id": "instrument-act-wildlife-and-countryside-act-1981",
    "instrument_type": "act",
    "legislation_url": "https://www.legislation.gov.uk/ukpga/1981/69",
    "made_under": null,
    "notes": null,
    "number": "69",
    "record_status": "extracted",
    "source_id": "source-act-wildlife-and-countryside-act-1981",
    "status": "in_force",
    "title": "Wildlife and Countryside Act 1981",
    "year": 1981
  },
  {
    "enacted_by": "Secretary of State (designation)",
    "instrument_id": "instrument-nps-water-resources",
    "instrument_type": "other",
    "legislation_url": "https://www.gov.uk/government/collections/national-policy-statements-for-water-resources-infrastructure",
    "made_under": "planning-act-2008-s5",
    "notes": "Designated National Policy Statement — the framework a DCO decision must have regard to (s.104). A proposal counter to it faces refusal / heightened risk: a mild-to-strong policy blocker, not a hard statutory veto. Orphan-instrument by design (no legislation.gov.uk provisions).",
    "number": null,
    "record_status": "extracted",
    "source_id": "source-framework-national-policy-statement-water-resources",
    "status": "in_force",
    "title": "National Policy Statement for Water Resources Infrastructure (designated framework)",
    "year": null
  }
]
